id,name,price,stock,image_url,category,description,subcategory
97,Macbook Air 13 M4,"1,700,000",3,https://pictures-nigeria.jijistatic.net/176296056_MzAwLTQwMC1kYmNkYzRkZGJm.webp,Electronics,Brand New Macbook Air M4 13-inch 16gb 512gb SSD Comes With Charger And Free Flash Drive,Computer
98,Dell Xps 13 ,"550,000",2,https://pictures-nigeria.jijistatic.net/170906047_MzAwLTMwMC0yZTdiYzdjNzdmLTE.webp,Electronics,Uk Used Dell Xps 13 Intel Core i7 16gb 1tb Windows 11,Computer
99,Hp Elitebook 830 G7,"700,000",4,https://pictures-nigeria.jijistatic.net/164834892_MzAwLTM3NS0yZDg0NjJlNTI3.webp,Electronics,London Used Hp Elitebook 830 G7 Intel Core i7 16gb 512gb SSD Touchscreen Display,Computer
100,Macbook Pro 14 M2 Max,"3,000,000",1,https://pictures-nigeria.jijistatic.net/145169420_MzAwLTQwMC1lZTgzMWMwMmYw.webp,Electronics,Brand New Macbook Pro M2 Max 14-inch 64fb 2tb SSD ,Computer
101,Asus Tuf Dash F15,"2,500,000",2,https://pictures-nigeria.jijistatic.net/161832479_MzAwLTI5My0wNzQ1NmRhMTlm.webp,Electronics,London Used Asus Tuf Dash F15 Intel Core i9 32gb 512gb SSD Mint Condition,Computer